{"counts":{"memberCount":14,"totalByteSize":42284,"totalRecordCount":23},"format":"spicy-artifact-member-manifest","formatVersion":"1.0","manifestId":"global:global","members":[{"byteSize":472,"mediaType":"text/html","objectKey":"blobs/FR-2026-03227.html","recordCount":null,"role":"rendition","schemaId":"text/html","sha256":"84a6378c11677f9320a76bfc6f2f9cfdfaa4fe3af9830fd8911aae4864952c61"},{"byteSize":263,"mediaType":"text/html","objectKey":"blobs/FR-2026-04188.html","recordCount":null,"role":"rendition","schemaId":"text/html","sha256":"d116373b617cf639c459efa1cad01f3516f6e3719866fa43cbfcc7c61436b1b5"},{"byteSize":2969,"mediaType":"application/json","objectKey":"data/documents.json","recordCount":2,"role":"documents","schemaId":"https://rulespec.org/schemas/releases/document-release-v2/documents-v1.schema.json","sha256":"e74264aeef2d6bb5a37f7784fc1ce4f4077492b0a10a73c55a41ec3ef9737fb5"},{"byteSize":3116,"mediaType":"application/json","objectKey":"data/search-segments.json","recordCount":7,"role":"search-segments","schemaId":"https://rulespec.org/schemas/releases/document-release-v2/search-segments-v1.schema.json","sha256":"e39da7d1b12bfe6de4d80da18671afed06b78568094f84b4560e601f71d49f09"},{"byteSize":1823,"mediaType":"application/json","objectKey":"data/source-dispositions.json","recordCount":6,"role":"source-dispositions","schemaId":"https://rulespec.org/schemas/releases/document-release-v2/source-dispositions-v1.schema.json","sha256":"7a25fba65b6cdf8f3baea1674bfc86b42bd022423f7ecceeab361e223740dd2c"},{"byteSize":2316,"mediaType":"application/json","objectKey":"data/structural-nodes.json","recordCount":8,"role":"structural-nodes","schemaId":"https://rulespec.org/schemas/releases/document-release-v2/structural-nodes-v1.schema.json","sha256":"25740d7ea88316f7d0094b7ed49aad2a01a0e9c5359970fb2ad66ffabdef6b8a"},{"byteSize":11592,"mediaType":"application/schema+json","objectKey":"schemas/document-release-v2.schema.json","recordCount":null,"role":"schema","schemaId":"https://rulespec.org/schemas/releases/document-release-v2.schema.json","sha256":"6fc03d564f250a9f875b70064edfb4e451f82fb618628f9c0dbe3c826daffe12"},{"byteSize":6076,"mediaType":"application/schema+json","objectKey":"schemas/documents-v1.schema.json","recordCount":null,"role":"schema","schemaId":"https://rulespec.org/schemas/releases/document-release-v2/documents-v1.schema.json","sha256":"94baa999ee3db9fa6f1c66331691ca7423bf1aed90e4d94f9eeb46a3710d4e66"},{"byteSize":3445,"mediaType":"application/schema+json","objectKey":"schemas/member-manifest-v1.schema.json","recordCount":null,"role":"schema","schemaId":"https://rulespec.org/schemas/releases/document-release-v2/member-manifest-v1.schema.json","sha256":"bf342695305b23501719e03e41b5d0de274b364260df466541f2f4826e6dcad7"},{"byteSize":3134,"mediaType":"application/schema+json","objectKey":"schemas/search-segments-v1.schema.json","recordCount":null,"role":"schema","schemaId":"https://rulespec.org/schemas/releases/document-release-v2/search-segments-v1.schema.json","sha256":"356399b34c9324a2327fe61c46c224cc9267904a4fb2cf9f44ef13bbc6c215db"},{"byteSize":3437,"mediaType":"application/schema+json","objectKey":"schemas/source-dispositions-v1.schema.json","recordCount":null,"role":"schema","schemaId":"https://rulespec.org/schemas/releases/document-release-v2/source-dispositions-v1.schema.json","sha256":"85bed3a6127184a5b9bfdb07bba3489e2d6311f738269273e3ac543d020b75e4"},{"byteSize":3058,"mediaType":"application/schema+json","objectKey":"schemas/structural-nodes-v1.schema.json","recordCount":null,"role":"schema","schemaId":"https://rulespec.org/schemas/releases/document-release-v2/structural-nodes-v1.schema.json","sha256":"d9ae6f283bd8181895728cc3501d795159fd638409e7d35131d66d6f30ab895c"},{"byteSize":380,"mediaType":"text/plain; charset=utf-8","objectKey":"text/FR-2026-03227.txt","recordCount":null,"role":"representation","schemaId":"text/plain; charset=utf-8","sha256":"59fe3d2aeb0f23b47b420fafcea3cc9154422a644a6dfe18b013f08271ed7a21"},{"byteSize":203,"mediaType":"text/plain; charset=utf-8","objectKey":"text/FR-2026-04188.txt","recordCount":null,"role":"representation","schemaId":"text/plain; charset=utf-8","sha256":"afdfe12b335c250afb53a14ee4cdb155e9477db5312c40fc913ea3fcf42c737b"}],"scope":{"id":"global","kind":"global"}}